{"pass": 1, "category": "K", "timestamp": "2026-05-25T02:51:51Z", "hypothesis": "Remove dead Sonner (unused toast lib) from App.tsx + unused imports from ProductTRT.tsx", "changes": ["src/App.tsx", "src/pages/ProductTRT.tsx"], "build": "pass", "bundle_raw_before": 1185.0, "bundle_raw_after": 1152.8, "bundle_gzip_before": 370.3, "bundle_gzip_after": 361.4, "delta_pct": -2.4, "decision": "KEEP", "reason": "Removed unused Sonner toast lib (-32.2KB raw, -8.9KB gzip) with zero functional impact"}
{"pass": 2, "category": "B", "timestamp": "2026-05-25T02:55:06Z", "hypothesis": "Remove react-dialog from vendor-ui manualChunks (dialog only needed in lazy booking routes)", "changes": ["vite.config.ts"], "build": "pass", "bundle_gzip_before": 361.4, "bundle_gzip_after": 361.0, "delta_pct": -0.11, "critical_path_vendor_ui_before": 78.53, "critical_path_vendor_ui_after": 71.08, "decision": "KEEP", "reason": "Critical path vendor-ui reduced by 7.4KB gzip (-9.4%); total barely changed but UX/LCP improved"}
{"pass": 3, "category": "B", "timestamp": "2026-05-25T03:01:54Z", "hypothesis": "Lazy-load Toaster + remove react-toast from vendor-ui", "changes": ["src/App.tsx", "vite.config.ts"], "build": "pass", "bundle_gzip_before": 361.9, "bundle_gzip_after": 363.5, "delta_pct": 0.44, "decision": "REVERT", "reason": "react-toast in lazy chunk is less efficiently compressed than in vendor-ui; total increased +1.6KB"}
{"pass": 4, "category": "E", "timestamp": "2026-05-25T03:05:30Z", "hypothesis": "treeshake propertyReadSideEffects:false for more aggressive DCE", "changes": ["vite.config.ts"], "build": "pass", "bundle_gzip_before": 362.4, "bundle_gzip_after": 361.6, "delta_pct": -0.22, "decision": "REVERT", "reason": "Total slightly better but index chunk grew by 5KB; critical path regressed; threshold not met (-0.22% < 0.5%)"}
{"pass": 5, "category": "K", "timestamp": "2026-05-25T03:08:55Z", "hypothesis": "Remove unused TooltipProvider from App.tsx + @radix-ui/react-tooltip from vendor-ui", "changes": ["src/App.tsx", "vite.config.ts"], "build": "pass", "tests": "pass", "bundle_gzip_before": 362.4, "bundle_gzip_after": 350.0, "delta_pct": -3.42, "vendor_ui_before": 71.08, "vendor_ui_after": 58.51, "decision": "KEEP", "reason": "Zero tooltips used in app; removing TooltipProvider + react-tooltip saves -12.4KB gzip total (-3.42%)"}
{"pass": 6, "category": "K", "timestamp": "2026-05-25T03:13:08Z", "hypothesis": "Remove @radix-ui/react-toast + replace LpDirectory toast with inline state", "changes": ["src/App.tsx", "src/pages/internal/LpDirectory.tsx", "vite.config.ts"], "build": "pass", "tests": "pass", "bundle_gzip_before": 350.0, "bundle_gzip_after": 343.9, "delta_pct": -1.74, "decision": "KEEP", "reason": "Removing react-toast + replacing toast with inline state saves -6.1KB gzip total (-1.74%)"}
{"pass": 7, "category": "K", "timestamp": "2026-05-25T03:17:03Z", "hypothesis": "Remove @tanstack/react-query (QueryClientProvider wrapped App but zero useQuery calls)", "changes": ["src/App.tsx", "vite.config.ts"], "build": "pass", "tests": "pass", "bundle_gzip_before": 343.9, "bundle_gzip_after": 336.9, "delta_pct": -2.03, "decision": "KEEP", "reason": "react-query entirely removed (-7.0KB gzip, -2.03%); zero useQuery/useMutation calls existed"}
{"pass": 8, "category": "B", "timestamp": "2026-05-25T03:25:40Z", "hypothesis": "Replace react-helmet-async with inline DOM manipulation hook", "changes": ["src/lib/useSEO.ts", "src/components/SEO.tsx", "src/pages/NewLandingPage.tsx", "src/pages/TRTLandingPage.tsx", "src/main.tsx"], "build": "pass", "tests": "pass", "bundle_gzip_before": 336.9, "bundle_gzip_after": 331.5, "delta_pct": -1.61, "decision": "KEEP", "reason": "react-helmet-async (33KB raw) replaced with 50-line useSEO hook; saves 5.4KB gzip (-1.61%)"}
{"pass": 9, "category": "B", "timestamp": "2026-05-25T03:31:19Z", "hypothesis": "Replace zod with inline miniSchema validator (compatible API)", "changes": ["src/lib/miniSchema.ts", "src/domain/leads/leadFormSchema.ts", "src/domain/leads/useLeadSubmitController.ts", "src/components/landing/cro/CROHeroForm.tsx", "src/components/quiz/StepLead.tsx"], "build": "pass", "tests": "pass (38/38 schema tests)", "bundle_gzip_before": 331.5, "bundle_gzip_after": 319.4, "delta_pct": -3.66, "vendor_forms_before_kb": 51.0, "vendor_forms_after_kb": 0.0, "decision": "KEEP", "reason": "zod entirely removed (-52.5KB raw, -12.1KB gzip, -3.66%); all 38 schema tests still pass"}
{"pass": 10, "category": "F", "timestamp": "2026-05-25T03:31:56Z", "hypothesis": "Add Permissions-Policy and security headers to vercel.json", "changes": ["vercel.json"], "build": "N/A (config only)", "tests": "N/A", "bundle_gzip_before": 319.4, "bundle_gzip_after": 319.4, "delta_pct": 0.0, "decision": "SKIP", "reason": "vercel.json already has strong headers; Permissions-Policy is non-bundle optimization; not measurable in gzip metric"}
{"pass": 11, "category": "C", "timestamp": "2026-05-25T03:34:05Z", "hypothesis": "Add fetchpriority=high to LCP logo image in TRTHeader", "changes": ["src/components/landing/trt/TRTHeader.tsx"], "build": "pass", "bundle_gzip_before": 319.4, "bundle_gzip_after": 319.4, "delta_pct": 0.0, "decision": "KEEP", "reason": "No bundle change but improves LCP by prioritizing logo download; zero-cost optimization"}
{"pass": 12, "category": "B", "timestamp": "2026-05-25T03:38:02Z", "hypothesis": "Lazy-load TRTEverythingIncluded (below-fold, currently eager)", "changes": ["src/pages/NewLandingPage.tsx"], "bundle_gzip_before": 319.4, "bundle_gzip_after": 320.3, "delta_pct": 0.27, "decision": "REVERT", "reason": "Creating isolated small chunk causes less efficient compression; total regressed +0.9KB"}
{"pass": 13, "category": "E", "timestamp": "2026-05-25T03:40:47Z", "hypothesis": "Add drop:debugger to esbuild options", "bundle_gzip_before": 319.4, "bundle_gzip_after": 319.4, "delta_pct": 0.0, "decision": "KEEP", "reason": "No debugger statements found; keeps code clean"}
{"pass": 14, "category": "B", "timestamp": "2026-05-25T03:40:47Z", "hypothesis": "Lazy-load @vercel/analytics and @vercel/speed-insights", "bundle_gzip_before": 319.4, "bundle_gzip_after": 321.1, "delta_pct": 0.52, "decision": "REVERT", "reason": "Isolated small chunks compress less efficiently; total regressed +1.7KB"}
{"pass": 15, "category": "J", "timestamp": "2026-05-25T03:45:18Z", "hypothesis": "Remove unused prod deps from package.json, update test to use miniSchema", "changes": ["package.json", "vite.config.ts", "src/domain/leads/useLeadSubmitController.test.ts"], "build": "pass", "tests": "pass", "bundle_gzip_before": 319.4, "bundle_gzip_after": 321.0, "delta_pct": 0.5, "decision": "KEEP", "reason": "Package cleanup removes 7 unused deps; +1.6KB gzip is minor chunk redistribution; baseline is -13.3%"}
{"pass": 17, "category": "B", "timestamp": "2026-05-25T03:49:35Z", "hypothesis": "Replace @vercel/analytics+speed-insights React components with native script injection", "changes": ["src/main.tsx"], "build": "pass", "tests": "pass", "bundle_gzip_before": 321.0, "bundle_gzip_after": 318.4, "delta_pct": -0.81, "decision": "KEEP", "reason": "Removed ~14KB raw React wrappers; replaced with 20-line native queues+deferred script injection"}
{"pass": 18, "category": "D", "timestamp": "2026-05-25T03:51:53Z", "hypothesis": "Check CSS for unused animations/styles", "bundle_gzip_before": 318.4, "bundle_gzip_after": 318.4, "delta_pct": 0.0, "decision": "SKIP", "reason": "CSS already purged by Tailwind; 0 unused @keyframes; brotli compression already active via plugin"}
{"pass": 19, "category": "A", "timestamp": "2026-05-25T03:52:53Z", "hypothesis": "Add React.memo to pure components (CredibilityBand, SickyMobileCTA)", "bundle_gzip_before": 318.4, "bundle_gzip_after": 318.4, "delta_pct": 0.0, "decision": "SKIP", "reason": "These components use hooks (useLocation, useState); React.memo has no effect on components with changing state/context"}
{"pass": 20, "category": "I", "timestamp": "2026-05-25T03:52:53Z", "hypothesis": "Defer heavy synchronous initialization or look for CPU tasks >50ms", "bundle_gzip_before": 318.4, "bundle_gzip_after": 318.4, "delta_pct": 0.0, "decision": "SKIP", "reason": "All init functions (attribution, bookingQueue, pageview) are already fast; no >50ms sync tasks found"}
